{
  "slug": "seated-stillness",
  "sanskrit": "Sukhasana",
  "english": "Seated Stillness",
  "aliases": ["Easy Seat"],
  "modes": [{"type": "both", "tissue_target": "both", "hold_range": {"min": 1, "max": 3}, "cue_notes": "Sit simply in an easy cross-legged seat, hands resting on the knees, spine tall but unforced, eyes closed. Used as a settle-in or close point rather than an active shape: no cueing beyond arriving and breathing."}],
  "body_position": "seated",
  "energetic_quality": ["calming", "grounding"],
  "difficulty": "accessible",
  "complexity": 1,
  "type_tags": ["restorative", "integration"],
  "breathing_cues": {
    "entering": "Settle into the seat and let the breath find its own natural rhythm.",
    "holding": "Simply observe the breath moving in and out, without changing it.",
    "exiting": "Take one deeper breath, then softly open the eyes."
  },
  "bilateral": false,
  "contraindications": ["knee-injury", "hip-injury"],
  "props_required": [],
  "prop_free_variation": null,
  "source": "Traditional hatha/vinyasa yoga",
  "base_of_support": ["sitbones"],
  "orientation": "upright",
  "cog_height": "low",
  "spinal_action": "neutral",
  "plane": "sagittal",
  "level": "low",
  "zone": "near",
  "energetic_direction": "samana",
  "intensity": 1,
  "injury_risk": 1,
  "counterposes": [],
  "rebound_pose": null,
  "default_measure": {"seconds": 120}
}
