{
  "slug": "warrior-1",
  "sanskrit": "Virabhadrasana I",
  "english": "Warrior 1",
  "aliases": ["Warrior One"],
  "modes": [{"type": "yang", "tissue_target": "muscular", "hold_range": {"min": 3, "max": 8}, "cue_notes": "Ground through the back heel, square the hips forward, and lift through the chest as the arms reach overhead. Hold for a steady breath count, keeping the front knee tracking over the ankle."}],
  "body_position": "standing",
  "energetic_quality": ["heating", "stimulating", "grounding"],
  "difficulty": "accessible",
  "complexity": 4,
  "type_tags": ["backbend", "hip-flexor-release", "quad-stretch"],
  "muscle_groups": ["hip-flexors", "quadriceps", "glutes", "spinal-erectors"],
  "breathing_cues": {
    "entering": "Inhale as you step the back foot into place and rise up through the spine, arms sweeping overhead.",
    "holding": "Steady even breaths; each inhale lengthens the spine, each exhale sinks the back heel and grounds the legs.",
    "exiting": "Exhale to release the arms and step the feet back together, or flow into the next shape."
  },
  "bilateral": true,
  "contraindications": ["knee-injury", "shoulder-injury", "sacroiliac-joint", "high-blood-pressure"],
  "props_required": [],
  "prop_free_variation": "Shorten the stance and keep the back heel lifted (high lunge) if the hips or sacrum resist squaring forward.",
  "source": "Traditional hatha/vinyasa yoga",
  "base_of_support": ["feet"],
  "orientation": "upright",
  "cog_height": "high",
  "spinal_action": "extension",
  "plane": "sagittal",
  "level": "high",
  "zone": "far",
  "energetic_direction": "brahmana",
  "intensity": 4,
  "injury_risk": 4,
  "counterposes": ["down-dog"],
  "rebound_pose": "down-dog",
  "default_measure": {"breaths": 5}
}
